course_id,course_title,url,price,level,content_duration,subject
1198654,How to set up a Web Server From Scratch to One Fully Managed,https://www.udemy.com/how-to-setup-a-web-server/,200,All Levels,3 hours,Web Development
1171966,The Complete PHP MySQL Professional Course with 5 Projects,https://www.udemy.com/the-complete-php-mysql-professional-course/,200,All Levels,19.5 hours,Web Development
833398,Angular Masterclass,https://www.udemy.com/angular-2-fundamentals-with-typescript-for-pro-developers-systemjs/,150,All Levels,6.5 hours,Web Development
140238,Become a Professional Web Developer | Version 3.0,https://www.udemy.com/web-development-tutorials/,200,All Levels,60 hours,Web Development
875194,Build Incredible Chatbots,https://www.udemy.com/build-incredible-chatbots/,100,All Levels,11.5 hours,Web Development
991630,Try Django 1.10 | Create a URL Shortening Service,https://www.udemy.com/try-django-1-10/,50,All Levels,5.5 hours,Web Development
303514,Projects in CSS,https://www.udemy.com/projects-in-css/,60,All Levels,10 hours,Web Development
134144,Ruby on Rails: Training and Skills to Build Web Applications,https://www.udemy.com/the-startups-guide-to-web-development-with-ruby-on-rails/,95,All Levels,7 hours,Web Development
1115222,Learn and Understand React,https://www.udemy.com/learn-and-understand-react-and-redux-i/,30,All Levels,16.5 hours,Web Development
94430,Learn Javascript & JQuery From Scratch,https://www.udemy.com/learn-javascript-jquery-from-scratch/,30,All Levels,2 hours,Web Development
788514,Learn to use JSON,https://www.udemy.com/learn-to-use-json/,150,Beginner Level,1.5 hours,Web Development
629142,The Ultimate Web Developer How To Guide,https://www.udemy.com/learn-web-development-complete-step-by-step-guide-to-success/,200,All Levels,22.5 hours,Web Development
992114,"Build A Complete CRUD Application With PHP, MYSQL & JQUERY",https://www.udemy.com/build-a-complete-crud-application-with-php-mysql-jquery/,20,All Levels,13.5 hours,Web Development
379722,jQuery Crash Course: Learn the Essentials of jQuery Fast,https://www.udemy.com/learn-jquery-crash-course/,50,All Levels,2 hours,Web Development
1189288,Drupal Tutorial : Drupal 8 Beginner to Expert in 8 PROJECTS,https://www.udemy.com/drupal-tutorial/,200,Beginner Level,7 hours,Web Development
652438,The Complete PHP CodeIgniter Course: Beginner To Advanced,https://www.udemy.com/codeignitercourse/,195,All Levels,4 hours,Web Development
1052304,JavaScript For Beginners : Learn JavaScript From Scratch,https://www.udemy.com/javascript-course-for-beginners/,195,All Levels,5.5 hours,Web Development
1223012,"Mastering 'Native CSS Shapes To Build Modern Web Pages""",https://www.udemy.com/mastering-native-css-shapes/,195,All Levels,3.5 hours,Web Development
882488,WordPress Development For Beginners,https://www.udemy.com/wordpress-basic/,95,All Levels,2 hours,Web Development
1033686,WordPress local server setup and site migration online,https://www.udemy.com/wordpress-local-install-and-two-methods-to-migrate-online/,55,All Levels,1 hour,Web Development
723522,PHP Fundamentals - Start Earning The Top Dollars You Deserve,https://www.udemy.com/php-fundamentals/,195,All Levels,1.5 hours,Web Development
1181900,Interactive Dynamic JavaScript for beginners DOM,https://www.udemy.com/javascript-dom/,200,Beginner Level,2 hours,Web Development
945336,Javascript Intermediate level 1 - Mastering the DOM,https://www.udemy.com/javascript-intermediate-mastering-the-dom/,100,All Levels,3 hours,Web Development
1079370,Sublime Text for Rapid Web Development,https://www.udemy.com/sublime-text-for-rapid-web-development/,20,All Levels,1 hour,Web Development
23742,Servlets and JSPs Tutorial: Learn Web Applications With Java,https://www.udemy.com/javawebtut/,35,All Levels,10 hours,Web Development
266252,Projects in PHP and MySQL,https://www.udemy.com/the-complete-web-development-course-learn-by-building-apps/,60,All Levels,23 hours,Web Development
473548,PHP OOP: Object Oriented Programming for beginners + Project,https://www.udemy.com/oop-php-object-oriented-programing-with-project-1-course/,200,All Levels,18 hours,Web Development
920544,React Redux React-Router: From Beginner to Paid Professional,https://www.udemy.com/react-redux-react-router/,20,All Levels,6.5 hours,Web Development
993754,Django Core | A Reference Guide to Core Django Concepts,https://www.udemy.com/django-core/,195,Intermediate Level,18.5 hours,Web Development
1155262,"Angular 2 Complete E-Commerce App Course - Java,Spring,MySQL",https://www.udemy.com/build-angular-2-complete-e-comerce-app-java-spring-mysql/,195,All Levels,20.5 hours,Web Development
997964,"Build An Online Bank With Java, Angular 2, Spring and More",https://www.udemy.com/build-an-online-bank-with-java-angular-2-spring-and-more/,195,Beginner Level,6.5 hours,Web Development
812588,The Complete jQuery Course: From Beginner To Advanced!,https://www.udemy.com/jquery-tutorial/,195,All Levels,6 hours,Web Development
531954,Projects in AngularJS - Learn by building 10 Projects,https://www.udemy.com/learn-angularjs-development/,40,All Levels,14.5 hours,Web Development
1022582,The Ultimate Vue JS 2 Developers Course,https://www.udemy.com/vuejs-2-essentials/,195,All Levels,13 hours,Web Development
1049092,React JS - Build real world JS apps & deploy on cloud,https://www.udemy.com/reactjs-for-beginners-build-real-world-react-apps-deploy-on-cloud/,175,All Levels,8.5 hours,Web Development
1277924,Angular 4 Front To Back,https://www.udemy.com/angular-4-front-to-back/,40,All Levels,8.5 hours,Web Development
964732,"Modern Web Development with SASS, Gulp, NPM & Web Workflows",https://www.udemy.com/modern-web-development-with-sass-gulp-npm-web-workflows/,95,Beginner Level,5 hours,Web Development
947120,"HTML5, CSS3 And JavaScript Fundamentals 2016",https://www.udemy.com/html5-css3-and-javascript-fundamentals-2016/,115,All Levels,1 hour,Web Development
712960,"Angular 4 - Concepts, Code and Collective Wisdom",https://www.udemy.com/angular-2-concepts-code-and-collective-wisdom/,50,Intermediate Level,4.5 hours,Web Development
267560,Learn E-Commerce Website in PHP & MySQL From Scratch!,https://www.udemy.com/ecommerce-website-in-php-mysqli/,0,All Levels,17.5 hours,Web Development
763774,JavaScript Game Development: Create Your Own Breakout Game,https://www.udemy.com/javascript-game-development-create-your-own-breakout-game/,0,All Levels,1.5 hours,Web Development
929016,HTML and HTML5 For Beginners 2016,https://www.udemy.com/html-and-html5-for-beginners-2016/,200,All Levels,3 hours,Web Development
281690,A Very Complete Introduction To Laravel,https://www.udemy.com/laravel-4-beginners/,20,All Levels,6 hours,Web Development
399228,"Learn to code, Become a Web Developer and Master JavaScript!",https://www.udemy.com/master-javascript-today/,200,All Levels,10 hours,Web Development
1023062,Serverless Architecture on Amazon Web Services,https://www.udemy.com/serverless-architecture-on-aws/,0,Intermediate Level,33 mins,Web Development
933260,jQuery Essentials: Learn the Fundamental of jQuery,https://www.udemy.com/jquery-essentials/,20,All Levels,3.5 hours,Web Development
494078,Expert Guide : Mastering Functions in JavaScript !,https://www.udemy.com/functions-in-javascript/,195,All Levels,2.5 hours,Web Development
1158572,Learn Angular 4 from Scratch,https://www.udemy.com/learn-angular-from-scratch/,0,Beginner Level,1.5 hours,Web Development
629082,Discover HTML Essential guide to HTML how to create webpages,https://www.udemy.com/intro-to-html-beginners-guide-to-html-how-to-create-webpages/,85,Beginner Level,1.5 hours,Web Development
1093734,HTML5 and CSS3 for beginners: Create a Website from Scratch,https://www.udemy.com/html5-and-css3-for-beginners-create-a-website-from-scratch/,200,Beginner Level,2 hours,Web Development
99986,Introduction to Web Development,https://www.udemy.com/introduction-to-web-development/,20,Beginner Level,2 hours,Web Development
566248,jQuery Fundamentals Powerful Bootcamp for beginners,https://www.udemy.com/jquery-fundamentals-bootcamp-learn-how-to-use-jquery/,150,All Levels,3 hours,Web Development
556248,The Complete HTML & CSS Course - From Novice To Professional,https://www.udemy.com/htmlwebsite/,195,All Levels,7.5 hours,Web Development
582392,JavaScript Basics Web Development Building Blocks,https://www.udemy.com/javascript-basics-web-development-building-blocks/,95,Beginner Level,1.5 hours,Web Development
582636,Bootstrap unleash the power faster & easier web development,https://www.udemy.com/bootstrap-3-responsive-design-tutorial-fundamentals/,150,All Levels,5.5 hours,Web Development
661802,JavaScript Design Patterns: 20 Patterns for Expert Code,https://www.udemy.com/javascript-design-patterns-20-patterns-for-expert-code/,95,Expert Level,3.5 hours,Web Development
1139400,Fix Google's New 'Not Secure' Warning with Let's Encrypt!,https://www.udemy.com/fix-googles-new-not-secure-warning-with-lets-encrypt/,95,Beginner Level,1 hour,Web Development
729552,JavaScript for Beginners Welcome to learning JavaScript,https://www.udemy.com/javascript-for-beginners-course/,50,Beginner Level,2 hours,Web Development
499632,Benefits of Thinking Mobile First Future of Website Design,https://www.udemy.com/thinking-mobile-websites-smart-design-tutorial/,75,Beginner Level,1.5 hours,Web Development
959586,Javascript from Beginner to Advanced Level,https://www.udemy.com/javascript-from-beginner-to-advanced-level/,195,Beginner Level,6.5 hours,Web Development
16151,AJAX Development,https://www.udemy.com/ajax-development/,20,All Levels,3 hours,Web Development
856490,Interaction Design Specialist For Web Developers,https://www.udemy.com/interaction-design-specialist-for-web-developers/,95,All Levels,2 hours,Web Development
861528,PHP Security,https://www.udemy.com/php-security/,50,All Levels,2.5 hours,Web Development
912996,The Bubble Course - Create Complete Web Apps without Coding,https://www.udemy.com/bubble-course/,30,Beginner Level,4.5 hours,Web Development
559512,The Complete HTML5 & CSS3 Course Build Professional Websites,https://www.udemy.com/html5css3/,195,All Levels,4.5 hours,Web Development
922600,CSS Web Development Crash Course,https://www.udemy.com/css-course/,20,Beginner Level,2.5 hours,Web Development
976284,Mastering DevOps,https://www.udemy.com/mastering-devops/,100,Intermediate Level,6 hours,Web Development
976598,Building Websites Create a fully functional Web contact form,https://www.udemy.com/how-to-create-a-fully-functional-web-contact-form/,200,Beginner Level,1.5 hours,Web Development
718426,Create a Dynamic User Registration Form from scratch,https://www.udemy.com/create-a-dynamic-user-registration-form-from-scratch/,100,Beginner Level,3 hours,Web Development
304490,A 13 Hour SQL Server 2014 /ASP.NET/CSS/C#/jQuery Course,https://www.udemy.com/learnsqlwithsqlserver2014/,35,Intermediate Level,14 hours,Web Development
15285,HTML Workshop,https://www.udemy.com/html-workshop/,20,All Levels,2 hours,Web Development
477702,Python for Beginners: Python Programming Language | Tutorial,https://www.udemy.com/python-course/,150,Beginner Level,5 hours,Web Development
875882,Creating Animations using HTML5 Canvas,https://www.udemy.com/hmtl5-canvas-animations/,25,All Levels,1 hour,Web Development
861122,Bootstrap 4: Exploring New Features,https://www.udemy.com/bootstrap-40exploring-new-features/,75,All Levels,1 hour,Web Development
309370,Bootstrap 3 -> Profitable WordPress Theme Development!,https://www.udemy.com/bootstrap-wordpress/,40,All Levels,3.5 hours,Web Development
802268,Intro to Git,https://www.udemy.com/intro-to-git/,20,Beginner Level,1 hour,Web Development
1034520,WordPress Domination #2: Leads & Scarcity,https://www.udemy.com/wordpress-domination-2-leads-and-scarcity/,95,Beginner Level,1 hour,Web Development
1016536,Learn How to Manage & Customize  Web Sites By Drupal CMS,https://www.udemy.com/drupal-course/,140,All Levels,2.5 hours,Web Development
711592,Using Modern JavaScript Today,https://www.udemy.com/using-modern-javascript/,50,Intermediate Level,16.5 hours,Web Development
1065250,Up and Running with jQuery,https://www.udemy.com/up-and-running-with-jquery/,0,All Levels,5 hours,Web Development
928858,Learn How To Build A Professional Web Site By Using Joomla,https://www.udemy.com/learn-how-to-build-a-professional-web-site-by-using-joomla/,70,All Levels,4 hours,Web Development
791030,Power up HTML5 with JavaScript,https://www.udemy.com/power-up-html5-with-javascript/,100,Beginner Level,2 hours,Web Development
1241518,Node Package Manager Course: Build and Publish NPM Modules,https://www.udemy.com/node-package-manager-course-build-and-publish-npm-modules/,30,All Levels,6.5 hours,Web Development
944886,WordPress Look and Feel with Themes,https://www.udemy.com/learn-wordpress-customize-look-and-feel-with-themes/,25,Beginner Level,1 hour,Web Development
758582,PHP with Laravel for beginners - Become a Master in Laravel,https://www.udemy.com/php-with-laravel-for-beginners-become-a-master-in-laravel/,150,All Levels,29.5 hours,Web Development
1199774,JavaScript 2017: Become Top Rated Web Developer,https://www.udemy.com/become-professional-javascript-developer/,115,All Levels,3 hours,Web Development
390866,The Complete Web Developer Bootcamp - Beginner to Expert,https://www.udemy.com/job-ready-web-developer/,190,All Levels,21.5 hours,Web Development
1014776,Full-Stack Web Apps with Meteor and React,https://www.udemy.com/meteor-react/,85,All Levels,31.5 hours,Web Development
929130,Angular 4: From Theory to Practice & FREE E-Book,https://www.udemy.com/angular-2-from-theory-to-practice/,200,Intermediate Level,15.5 hours,Web Development
746014,The Complete Sass & SCSS Course: From Beginner to Advanced,https://www.udemy.com/sasscourse/,195,All Levels,4 hours,Web Development
11475,Become a Certified Web Developer,https://www.udemy.com/become-a-certified-web-developer/,100,All Levels,12 hours,Web Development
11174,Become a Web Developer from Scratch,https://www.udemy.com/how-to-become-a-web-developer-from-scratch/,120,All Levels,27.5 hours,Web Development
945978,Ultimate Angular 4 (previously Angular 2) with Bootstrap 4,https://www.udemy.com/ultimate-angular-2/,50,All Levels,5.5 hours,Web Development
1019276,The Ultimate Beginner's Guide to Django,https://www.udemy.com/the-ultimate-beginners-guide-to-django-python-web-dev-website/,200,Beginner Level,9 hours,Web Development
1252630,React JS - Mastering Redux,https://www.udemy.com/react-js-mastering-redux/,100,All Levels,5 hours,Web Development
1000010,Professional Ruby on Rails Developer with Rails 5,https://www.udemy.com/pro-ruby-on-rails-rails5/,200,All Levels,20.5 hours,Web Development
937586,"Ruby on Rails 5 - BDD, RSpec and Capybara",https://www.udemy.com/ruby-rails-5-bdd-rspec-capybara/,200,All Levels,14.5 hours,Web Development
79154,Back to School Web Development and Programming Bundle,https://www.udemy.com/back-to-school-web-development-and-programming-bundle/,200,Beginner Level,44.5 hours,Web Development
328476,Complete ASP NET MVC Web Development - Newbie to Ninja!,https://www.udemy.com/better-web-development-pro-techniques-for-success/,195,All Levels,9 hours,Web Development
921474,The Complete DevOps Engineer Course 2.0 - Java & Kubernetes,https://www.udemy.com/the-complete-devops-engineer-course-20-java-kubernetes/,195,All Levels,14 hours,Web Development
82778,All about NodeJS,https://www.udemy.com/all-about-nodejs/,50,All Levels,15.5 hours,Web Development
907386,How To Create A Wordpress Website 2016 | NEW Divi Theme 3.0!,https://www.udemy.com/how-to-create-a-wordpress-website-2016-new-divi-theme-30/,40,Beginner Level,5.5 hours,Web Development
877124,The Complete jQuery Course - From Beginner to Professional!,https://www.udemy.com/complete-jquery-developer-course-beginner-to-pro/,200,All Levels,22.5 hours,Web Development
1169378,Build a complete Fiverr clone with Node + Algolia + Paypal,https://www.udemy.com/web-developer-build-fiverr-twitter-and-mvp-with-nodejs/,30,All Levels,9 hours,Web Development
30240,The Ultimate Web Development Course,https://www.udemy.com/build-an-instant-update-database-interface-with-jquery-ajax/,50,All Levels,12 hours,Web Development
836044,React From The Ground Up,https://www.udemy.com/reactjs-from-the-ground-up/,150,All Levels,12.5 hours,Web Development
405818,Javascript for Beginners Learn by Doing Practical Exercises,https://www.udemy.com/javascript-for-beginners-introduction-learn-fast-easy/,100,All Levels,3.5 hours,Web Development
665042,8 Beautiful Ruby on Rails Apps in 30 Days & TDD - Immersive ,https://www.udemy.com/8-beautiful-ruby-on-rails-apps-in-30-days/,100,All Levels,16 hours,Web Development
1068590,Wordpress Website Mastery 2017,https://www.udemy.com/wordpress-website-mastery-2017/,0,Beginner Level,2.5 hours,Web Development
1203894,How To Make an eCommerce Website With Wordpress 2017,https://www.udemy.com/how-to-make-an-ecommerce-website-with-wordpress-2017/,0,Beginner Level,4.5 hours,Web Development
994634,Mastering ASP.NET MVC 5 From Scratch Using C#,https://www.udemy.com/masteringaspnetmvc5/,50,All Levels,13 hours,Web Development
765916,Start Web Development with GIS Map in JavaScript,https://www.udemy.com/start-web-development-with-gis-map-in-javascript/,60,All Levels,3 hours,Web Development
128950,Learn to Build Websites using Twitter Bootstrap,https://www.udemy.com/learn-to-build-websites-using-twitter-bootstrap/,0,All Levels,2.5 hours,Web Development
549064,Web Development Tools the Pros Use: Code Productivity Hacks,https://www.udemy.com/web-development-tools/,30,Beginner Level,4 hours,Web Development
400280,WordPress : An Overview,https://www.udemy.com/what-is-wordpress/,45,Beginner Level,36 mins,Web Development
382856,Create Startup Landing Page with Viral Marketing Strategies,https://www.udemy.com/create-startup-landing-page-with-viral-marketing-strategies/,0,Beginner Level,1 hour,Web Development
958982,JavaScript : JavaScript Awesomeness,https://www.udemy.com/javascript-javascript/,25,Beginner Level,1 hour,Web Development
1113036,Mastering CSS 3.0 Selectors,https://www.udemy.com/css3-selectors/,0,Intermediate Level,2 hours,Web Development
226534,WordPress Backup And Restore Fundamentals,https://www.udemy.com/wordpress-backup-and-restore-fundamentals/,0,Intermediate Level,1 hour,Web Development
738726,Learn HTML and CSS to make a Website,https://www.udemy.com/learn-html-and-css-to-make-website/,20,Beginner Level,6 hours,Web Development
64422,1 Hour HTML,https://www.udemy.com/1-hour-html/,200,Beginner Level,1 hour,Web Development
874166,Angular 2 Crash Course with TypeScript,https://www.udemy.com/angular-2-crash-course/,100,All Levels,4 hours,Web Development
1197650,Boost your website speed without any coding!,https://www.udemy.com/boost-your-website-speed-without-any-coding/,50,All Levels,1 hour,Web Development
912946,Professional Rails Code Along,https://www.udemy.com/professional-ruby-on-rails-coding-course/,40,Intermediate Level,19 hours,Web Development
876544,ASP.NET Web API 2 Hands-On,https://www.udemy.com/aspnet-web-api-2-hands-on/,20,All Levels,1.5 hours,Web Development
1205894,Create a MEAN App by Example - Full Stack Course,https://www.udemy.com/full-stack-course-mean-app/,50,Intermediate Level,3.5 hours,Web Development
19332,The Original Complete Web Developer Course.,https://www.udemy.com/thecompletewebdeveloper/,20,Beginner Level,18 hours,Web Development
863954,Angular 2 From The Ground Up,https://www.udemy.com/angular-2-from-the-ground-up/,30,All Levels,11.5 hours,Web Development
789324,Complete Web Development Course + Building 5 Websites!,https://www.udemy.com/creating-5-web-development-projects-in-html5-and-css3/,200,All Levels,24.5 hours,Web Development
1229274,WP Plugin Development - Build your own plugin!,https://www.udemy.com/wp-plugin-development-build-your-own-plugin/,200,Beginner Level,4 hours,Web Development
906700,Sass: From Beginner to Advanced,https://www.udemy.com/sass-from-beginner-to-advanced/,40,All Levels,2 hours,Web Development
113706,Build Flat Responsive Website from Scratch - Complete Course,https://www.udemy.com/build-flat-responsive-website-from-scratch-complete-course/,35,All Levels,7.5 hours,Web Development
604044,Wordpress for Beginners - Build a Live Website from Scratch,https://www.udemy.com/wordpress_for_beginners/,20,Beginner Level,1.5 hours,Web Development
531290,"Essential JavaScript, jQuery and AngularJS Training",https://www.udemy.com/essential-javascript-jquery-angularjs-training/,30,Intermediate Level,7 hours,Web Development
436210,The Pro Ruby on Rails Starter,https://www.udemy.com/pro-rubyonrails-starter/,45,Beginner Level,2.5 hours,Web Development
617158,Unit Testing AngularJS: Build Bugfree Apps That Always Work!,https://www.udemy.com/unit-testing-angularjs/,25,All Levels,2.5 hours,Web Development
1121580,WordPress Blog : Create a WordPress Website for Beginners,https://www.udemy.com/wordpress-website-for-beginners/,20,Beginner Level,2 hours,Web Development
782192,Introduction to HTML5 Canvas basics of drawing,https://www.udemy.com/introduction-to-html5-canvas-basics-of-drawing/,200,Beginner Level,1 hour,Web Development
978728,"Thoughtful Web Development Course: HTML, Vue.js, PHP, MySQL",https://www.udemy.com/web-development-html5-css3-php-oop-and-mysql-database/,200,All Levels,25 hours,Web Development
65493,Kids Coding - Beginners CSS,https://www.udemy.com/kids-coding-beginners-css/,100,All Levels,1 hour,Web Development
32649,PHP & MySQL - Learn The Easy Way. Master PHP & MySQL Quickly,https://www.udemy.com/learning-php-and-mysql-development-the-easy-way/,50,All Levels,15.5 hours,Web Development
1225030,Learning Path: Magento: Master and Test Magento 2 with Ease,https://www.udemy.com/learning-path-magento-master-and-test-magento-2-with-ease/,200,Expert Level,6 hours,Web Development
903140,The Complete hapiJS Course - Go From Beginner To Advanced!,https://www.udemy.com/hapijs-course/,195,All Levels,6 hours,Web Development
372518,Ruby On Rails For Web Development,https://www.udemy.com/ruby-on-rails-for-web-development/,195,Beginner Level,5 hours,Web Development
1045862,Create eye-catching WordPress website from scratch,https://www.udemy.com/create-eye-catching-wordpress-website-from-scratch/,30,Beginner Level,4.5 hours,Web Development
99826,Become A Web Developer And Seller - Build Websites With HTML,https://www.udemy.com/the-ultimate-building-and-selling-websites-course/,200,Beginner Level,2.5 hours,Web Development
1236746,WordPress Tips and Tricks,https://www.udemy.com/wordpress-tips-and-tricks/,200,Intermediate Level,2.5 hours,Web Development
1110756,HTML Tutorials : HTML Code for Website Creating,https://www.udemy.com/html-code-for-website/,20,All Levels,3 hours,Web Development
595728,Complete HTML5 and CSS3 Course +1 Start to Finish Project,https://www.udemy.com/complete-html5-and-css3-course-1-start-to-finish-project/,200,All Levels,8.5 hours,Web Development
1231872,Web Development With HTML CSS BOOTSTRAP JQUERY for Beginners,https://www.udemy.com/web-development-with-html-css-bootstrap-jquery-for-beginners/,35,Beginner Level,5 hours,Web Development
876850,HTML5 Specialist: Comprehensive HTML5 Training,https://www.udemy.com/html5-specialist/,100,All Levels,5 hours,Web Development
113518,CSS and CSS3 For Absolute Beginners,https://www.udemy.com/css-and-css3-for-absolute-beginners/,75,Beginner Level,5 hours,Web Development
1111552,Build a Complete JQuery Plugin (Image Pop-up Dialog),https://www.udemy.com/build-a-complete-jquery-plugin-image-pop-up-dialog/,20,All Levels,1 hour,Web Development
834924,How to create HTML Forms,https://www.udemy.com/how-to-create-html-forms/,30,Beginner Level,40 mins,Web Development
764042,ReactJS and Flux: Learn By Building 10 Projects,https://www.udemy.com/reactjs-and-flux-learn-by-building-10-projects/,60,All Levels,11 hours,Web Development
821526,How To Make A Business Website In 1 Day With Wix FAST & EASY,https://www.udemy.com/how-i-make-a-professional-website-in-1-day-or-less-with-wix/,20,Beginner Level,4 hours,Web Development
838418,PHP Date and Time Course by Edwin Diaz,https://www.udemy.com/crash-course-learn-to-create-date-and-time-in-php-easily/,40,All Levels,1.5 hours,Web Development
342084,Start Your Own Forum Website in 15 Minutes ,https://www.udemy.com/forum-web-development/,40,All Levels,1 hour,Web Development
669536,Hit the ground running with AngularJS with Dion Yang,https://www.udemy.com/hit-the-ground-running-with-angularjs-with-dion-yang/,100,All Levels,1.5 hours,Web Development
511378,Learn CSS Transition and Animation ,https://www.udemy.com/css-transition-and-animation/,100,All Levels,1 hour,Web Development
553582,Learn JavaScript from scratch,https://www.udemy.com/learn-javascript-from-scratch/,20,Beginner Level,2.5 hours,Web Development
566920,WordPress for Beginners - Tutorial - From Novice to Know-How,https://www.udemy.com/wordpress-for-beginners-tutorial-from-novice-to-know-how/,20,Beginner Level,4 hours,Web Development
406820,RESTful API with Laravel,https://www.udemy.com/laravel-5-php-framework-agile-and-practical-php-restful-api/,45,All Levels,6 hours,Web Development
636418,Learn Ruby on Rails for Absolute Beginners,https://www.udemy.com/learn-ruby-on-rails-for-absolute-beginners/,195,All Levels,4.5 hours,Web Development
986442,JavaScript Tutorial,https://www.udemy.com/lets-learn-javascript-by-coding/,180,All Levels,4.5 hours,Web Development
996320,Shopping Cart Website from Scratch Ecommerce,https://www.udemy.com/shopping-cart/,200,Beginner Level,4 hours,Web Development
936182,Learn By Example: Angular JS,https://www.udemy.com/learn-by-example-angular-js/,50,All Levels,7 hours,Web Development
905850,The Complete front end web developer Bootcamp - 14 projects,https://www.udemy.com/complete-front-end-web-developer-bootcamp/,200,All Levels,18.5 hours,Web Development
